<?xml version="1.0" encoding="UTF-8"?>
<secretSocialML xmlns:xsi="http://www.w3.org/2001/XMLSchema-instance"
    xsi:noNamespaceSchemaLocation="task2_SecretSocialML.xsd">
    
    <!-- Users -->
    <user id="1">
        <name>Johnnyboy 123</name>
        <sex>m</sex>
        <dateOfBirth>1987-01-01</dateOfBirth>
        <friends>
            <userID>2</userID>
            <userID>3</userID>
        </friends>
        <societies>
            <socID>1</socID>
            <socID>2</socID>
        </societies>
        <profession>Software Engineer</profession>
    </user>
    <user id="2">
        <name>Tom Turbo</name>
        <sex>m</sex>
        <dateOfBirth>1987-01-02</dateOfBirth>
        <friends>
            <userID>1</userID>
        </friends>
        <societies>
            <socID>1</socID>
        </societies>
    </user>
    <user id="3">
        <name>Jack</name>
        <sex>m</sex>
        <dateOfBirth>1987-01-03</dateOfBirth>
        <friends>
            <userID>1</userID>
            <userID>4</userID>
        </friends>
        <societies>
            <socID>2</socID>
        </societies>
    </user>
    <user id="4">
        <name>Anna</name>
        <sex>f</sex>
        <dateOfBirth>1987-01-04</dateOfBirth>
        <friends>
            <userID>3</userID>
        </friends>
        <societies/>
    </user>
    
    
    <!-- Societies -->
    <society id="1">
        <name>Fight Club</name>
        <description>We fight illegally</description>
        <members>
            <userID>1</userID>
            <userID>2</userID>
        </members>
    </society>
    <society id="2">
        <name>Gamble Club</name>
        <description>We gamble illegally</description>
        <members>
            <userID>1</userID>
            <userID>3</userID>
        </members>
    </society>
</secretSocialML>
